REVIEW;FEELING
Eu possuo 2 desses casos e pediria outro.;1
Ótimo telefone.;1
Comprei esta bateria com um cupom da Amazon e estou muito feliz com minha compra.;1
O acesso à Internet foi bom, o raro exemplo de que funcionou.;0
Perfeito para o PS3.;1
Cinco estrelas Plus, mais.;1
Uma pechincha de boa qualidade. Comprei isso depois que comprei um barato da Big Lots que parecia horrível e as pessoas do outro lado não conseguiam me ouvir.;1
$ 50 Pelo ralo.;0
Tentei falar bem alto, mas gritar no telefone ficou velho e ainda me disseram que não era ótimo.;0
Bom, funciona bem.;1
Pelo preço, este foi um ótimo negócio.;1
Ótimo preço também!;1
Se houver vento, é completamente inútil.;0
Sim, é brilhante na frente - e eu adoro!;1
Não funciona.;0
No começo, eu pensei que estava ganhando bastante em US $ 7,44, até conectá-lo ao meu telefone (V3c Razr).;0
A recepção através deste fone de ouvido é excelente.;1
2 pontos positivos deste vendedor;1
Eu tenho um telefone da Verizon LG e eles funcionam bem juntos, boa recepção e alcance que excede a 20 pés da linha de visão.;1
Descrição inadequada .... Eu tive que devolvê-lo.;0
# 1 Funciona - # 2 É confortável.;1
A vida útil da bateria é bastante longa.;1
Os Jabra EarGels se encaixam muito bem nos meus ouvidos.;1
A bateria não tem vida útil.;0
Eu verifiquei em todos os lugares e não há nenhum recurso, o que é realmente decepcionante.;0
O produto é exatamente como descrito.;1
Recebe um sinal quando outros telefones da Verizon não o fazem.;1
Não faz o trabalho.;0
Eu recomendaria.;1
Planeje encomendar uma e outra vez.;1
"Dito isto, para um telefone, a câmera é muito boa; muitos efeitos legais para brincar, e o vídeo também é decente.";1
Fiquei muito satisfeito com este telefone celular desde o primeiro dia.;1
Eles continuam melhorando cada vez mais (este é o meu terceiro e eu também tive várias Palms).;1
Inábil de usar e não confiável.;0
O tempo de entrega também foi muito rápido!;1
Não é tão bom quanto eu esperava.;0
Bom caso!;1
Não funciona.;0
Produto realmente bom.;1
Infelizmente não funcionou.;0
Todos os três quebraram dentro de dois meses de uso.;0
não compre.;0
Meu pai tem o V265 e a bateria está acabando.;0
No entanto, os protetores auriculares se soltam facilmente e depois de apenas uma semana eu perdi um.;0
As chamadas caem, o telefone liga e desliga à vontade, a tela fica preta e o pior de tudo deixa de tocar intermitentemente.;0
Horrível, horrível protetor.;0
Também não gosto deste Nokia.;0
Atingir a linha inferior é desconfortável, e as chaves de envio e de finalização não estão onde eu espero que elas estejam.;0
Eu comprei este celular Nokia há algumas semanas e foi um pesadelo.;0
Levaria muito tempo para descrever o quão ruim minha experiência de atendimento ao cliente tem sido com a Amazon.;0
a única coisa MUITO decepcionante foi que não havia nenhum alto-falante !!!!;0
Terrível .. Meu carro não aceita esta fita.;0
O produto é inútil, pois não possui corrente de carga suficiente para carregar os dois celulares com os quais eu planejava usá-lo.;0
Não é o que diz que é.;0
Fique longe do Q !.;0
Usado e sujo.;0
Serviço muito confiável da T-mobile!;0
Não é bom o suficiente para o preço.;0
Eu comprei dois deles e nenhum deles cobrará.;0
Parece muito bom.;1
Essa é uma excelente ferramenta, especialmente quando combinada com a resposta automática do seu telefone.;1
Eu li os comentários de outros aqui, mas não tive nenhum problema com isso.;1
Esses produtos encobrem o importante sensor de luz acima da saída do ouvido.;0
Confortável na minha mão.;1
Apenas não funciona.;0
Baixa confiabilidade.;0
(Funciona!);1
Se eu tirar uma foto, a bateria cai uma barra e começa a emitir um sinal sonoro, informando que está morrendo.;0
Produto terrível e desperdício de dinheiro!;0
Última vez comprando de você.;0
Foi um desperdício do meu dinheiro.;0
Até agora, funcionou como um encanto.;1
Eu só tenho há algumas semanas, mas até agora, tudo bem.;1
Mas, em qualquer caso, a melhor parte é que você pode baixar essas fotos para o seu laptop usando IR, ou até mesmo enviar fotos do seu laptop para o telefone.;1
Recomendaria este item.;1
"É o meu fone de ouvido preferido há anos. Ótimo som; bom volume; bom cancelamento de ruído.";1
Bom caso, é bom em suas mãos.;1
O item recebido foi Falsificado.;0
Muito bom .. Até agora, provavelmente o melhor fone de ouvido BT que eu já tive.;1
Funciona bem.;1
Recebi meu fone de ouvido em tempo útil e fiquei feliz com ele.;1
Fiquei muito satisfeito ao ver que eu poderia substituir meu coldre giratório bem dobrado pelo meu flip Blackberry.;1
Minha irmã também tem uma e ela adora.;1
Boa qualidade.;1
Esta é de longe a pior compra que já fiz na Amazon.;0
Excelente fone de ouvido de dupla finalidade.;1
Excelente!.;1
Não funciona para ouvir música com o cingular 8125.;0
Parece completamente seguro, segurando o meu cinto e mantendo o iPhone dentro.;1
A linha de fundo ... outro truque barato e sem valor da Sprint.;0
Tendo problemas com o volume.;0
A única coisa boa é que se encaixa confortavelmente em orelhas pequenas.;1
AVISO - NÃO COMPRE !!.;0
Estou emparelhando isso com o meu iphone e não poderia estar mais feliz com ele até agora.;1
Quando é aberta, a conexão da bateria é interrompida e o dispositivo é desligado.;0
Não queria que o clipe passasse por cima da minha orelha, causando desconforto.;0
Melhor fone de ouvido de todos os tempos !!!.;1
Não confie no site deles e não espere nenhum suporte útil.;0
Era alto o suficiente para dizer que o Plantronics 510 mantém uma conexão perfeita com o meu celular e sem estática durante o uso normal.;1
O alto-falante é de baixa qualidade, fazendo com que os toques soem muito baratos.;0
Cabe confortavelmente, veio com três tamanhos de dicas de fones de ouvido.;1
Excelente produto pelo preço.;1
Má recepção.;0
Este produto é de alta qualidade EXCREMENTO chinês !!!!!!;0
Era bastante confortável no ouvido.;1
Ótimo telefone.;1
Não compre este produto - ele falha !.;0
Tudo neste produto está errado.;0
O emparelhamento dos dois dispositivos foi tão fácil que demorou alguns minutos para eu começar a fazer chamadas com o recurso de discagem por voz.;1
Isso foi totalmente confuso no começo, o que me levou a perder alguns contatos muito, muito importantes.;0
Terrible phone holder.;0
Os recortes e botões são colocados perfeitamente.;1
Adoro poder usar um fone de ouvido tanto por telefone fixo quanto por celular.;1
O problema é que as alças são feitas de material fraco e quebram facilmente.;0
Não é tão bonito quanto a imagem da AMAZON faz parecer.;0
Mas, apesar dessas poucas falhas, este gabinete é de qualidade excepcional e vale os custos adicionais de possuir um produto oficial do OEM.;1
Quão estúpido é isso?;0
Eu posso ouvir enquanto estou dirigindo o carro, e geralmente nem preciso colocá-lo no ambiente mais alto.;1
Vendedor enviado rapidamente e muito mais barato que os concorrentes.;1
Bom show, Samsung.;1
Então, eu comprei cerca de 10 delas e economizei muito dinheiro.;1
Ele sempre corta e emite um sinal sonoro e, em seguida, indica que o sinal falhou.;0
Não foi possível descobrir;0
Meu telefone parecia bom (nada bom - OK), mas o telefone da minha esposa era quase totalmente ininteligível, ela não conseguia entender uma palavra dita nele.;0
Então eu tive que tirar a bateria do telefone, juntar tudo novamente e depois reiniciá-la.;0
Enquanto eu conseguia dobrar a mola de folhas de volta no lugar, o metal agora tem tensão suficiente para quebrar na próxima gota.;0
A cópia do leopardo é maravilhosamente selvagem !.;1
Funciona para mim.;1
Flacidez, pedaço de lixo flexível.;0
muito melhor do que os casos de plástico rígido.;1
Também teve um novo problema.;0
Feliz até agora!;1
telefone legal.;1
Funciona bem.;1
A Motorola finalmente conseguiu a qualidade de voz de um fone de ouvido bluetooth.;1
Ele perde a conexão com o telefone, mesmo quando está a alguns centímetros entre os dois.;0
mas é ótimo, eu realmente recomendo;1
Torna mais fácil acompanhar o meu bluetooth quando não o estou usando.;0
Como eu disse acima .... MUITO INÚTIL!;0
Nunca entendi !!!!!;0
Este par de fones de ouvido é o pior que já tive em termos de som.;0
[...] pelo ralo por causa de um estalo fraco!;0
Não carrega o telefone Cingular (ATT) 8525.;0
"Você recebe minutos extras para poder atender a chamada e não ser cortado. """;1
No entanto, após cerca de um ano, o fliptop começou a ficar solto e trêmulo e, eventualmente, minha tela ficou preta e eu não consegui receber e fazer chamadas.;0
Continuei pegando o cabo no banco e tive que puxar o telefone para desligá-lo.;0
O fone de ouvido atende aos meus requisitos, por isso estou feliz com minha compra.;1
O fone de ouvido Bluetooth da Logitech é um 10 !.;1
Eu gosto do fato de que ele repousa levemente contra seu ouvido, e não por dentro.;1
Muitos sites classificaram esse telefone muito bom, e eu também.;1
Eu tentei esses cabos com meu computador e meu iPod e funciona muito bem.;1
O microfone é uma piada e o volume é bastante baixo.;0
Vou devolvê-los.;0
Não mantenho uma conexão com o computador enquanto ele está no meu colo.;0
É fácil ligar e desligar quando você está no carro e os controles de volume são bastante acessíveis.;1
Eu tenho o meu há cerca de um ano e, neste Natal, comprei alguns para o resto da família.;1
Caso contrário, fácil de instalar e usar, som nítido.;1
couro legal.;1
Eu tive que comprar um caso diferente.;0
É uma alegria usar.;1
Muito decepcionado com esta empresa.;0
Muito satisfeito com isso.;1
Não foi cobrado por mim.;0
Este é o telefone para comprar em 2005 .... Acabei de comprar meu S710a e tudo o que posso dizer é WOW!;1
Os botões são muito pequenos.;0
Apenas ler apenas as especificações faz você dizer WOW.;1
Adoro .. Ótima braçadeira.;1
Eu realmente gosto deste produto em relação à Motorola, porque é muito mais claro na parte da orelha e no microfone.;1
No entanto, os teclados são tão pequenos que às vezes alcanço os botões errados.;0
Troquei o sony ericson z500a por isso e estou muito feliz com essa decisão.;1
Fiquei muito impressionado com o preço dos casos.;1
Também facilita a manutenção.;1
Eu uso este produto em um centro de controle de motores, onde há muito zumbido de alta tensão no equipamento, e funciona muito bem!;1
É bem fácil.;1
Não consigo fazer ligações em determinados lugares.;0
no entanto, minha garota se queixou de que algum tempo o telefone não acorda como o telefone normal.;0
Estilo bonito embora.;1
Esta empresa cobra uma taxa de reabastecimento e ainda não me devolveu o reembolso.;0
Estou tentando devolvê-lo para um reembolso.;0
Liguei-o apenas para descobrir que nada de danado funcionava.;0
Produto excelente.;1
A peça do fone de ouvido se quebra facilmente.;0
Produto ruim.;0
Este telefone se esforça muito para fazer tudo, mas falha porque é muito capaz de ser um telefone.;0
É o melhor carregador que eu já vi no mercado.;1
MELHOR TELEFONE !!!;1
:-) Oh, o carregador parece funcionar bem.;1
Ele se encaixa com tanta segurança que o gancho do ouvido nem precisa ser usado e o som é direcionado melhor através do canal auditivo.;1
Volume insuficiente.;0
Problema de eco .... Muito insatisfatório;0
você só pode gravar 2 vídeos por vez e a qualidade é muito baixa.;0
não desperdice seu dinheiro.;0
Vou ter que ser o primeiro a analisar negativamente este produto.;0
O adaptador não fornece corrente de carga suficiente.;0
Havia tanta propaganda nesse telefone que eu assumi que era o melhor, meu erro.;0
Você também não pode tirar fotos com o estojo porque a lente está coberta.;0
O telefone cai facilmente.;0
Não deu certo, as pessoas não podem me ouvir quando eu falo.;0
O recurso de mensagens de texto é realmente complicado de usar.;0
Estou realmente decepcionado, tudo o que tenho agora é um carregador que não funciona.;0
Doloroso na orelha.;0
Durou um dia e depois explodiu.;0
desapontado.;0
Tipo de fracassos.;0
A tela fica manchada facilmente porque toca sua orelha e seu rosto.;0
Que lixo ... Perco mais ligações neste telefone.;0
O item não corresponde à imagem.;0
A única coisa que me decepciona é o porto de infravermelho (irda).;0
Você não pode atender chamadas com a unidade, nunca funcionou uma vez!;0
