REVIEW;FEELING
Portanto, não há como conectá-lo aqui nos EUA, a menos que eu use um conversor.;0
Bom caso, valor excelente.;1
Ótimo para o maxilar.;1
Ligado ao carregador para conversas com duração superior a 45 minutos. PRINCIPAIS PROBLEMAS !!;0
O microfone é ótimo.;1
Eu tenho que apertar o plugue para alinhar corretamente para obter um volume decente.;0
Se você tiver várias dezenas ou centenas de contatos, imagine a diversão de enviar cada um deles um por um.;0
Se você é proprietário do Razr ... você deve ter isso!;1
Escusado será dizer que desperdicei meu dinheiro.;0
