REVIEW;FEELING
Ah, e eu esqueci de mencionar também o efeito de cor estranho que ele tem no seu telefone.;0
Estou usando-o com um iriver SPINN (com estojo) e ele se encaixa bem.;1
Também a área onde minha unidade quebrou) .- Não gosto muito da fita magnética.;0
No geral, estou empolgado por ter um telefone com todos os meus compromissos e contatos e com ótima recepção.;1
tudo no telefone funciona perfeitamente, ela gosta.;1
Outra observação sobre a aparência deste telefone é que ele realmente parece um pouco sem graça, especialmente no modelo totalmente preto.;0
É MUITO FÁCIL.;1
Meu Sanyo sobreviveu a dezenas de quedas no asfalto sem efeitos negativos.;1
Fones de ouvido fantásticos.;1
Ele encontra meu celular imediatamente quando entro no carro.;1
Baixa qualidade.;0
Eu recomendo este telefone celular com preços modestos.;1
Mas obtém melhor recepção e clareza do que qualquer telefone que eu já tinha antes.;1
Aviso - Fique longe.;0
Eu gostaria de poder devolver a unidade e recuperar meu dinheiro.;0
Dispositivo impressionante funciona muito bem!;1
Eu costumava falar sobre isso por 1 a 1 hora e meia e a bateria fica literalmente descarregada e morrendo.;0
Se você não o encontrar, é muito ruim, pois novamente a unidade vem com apenas um fone de ouvido. Eu não recomendaria isso a ninguém.;0
Muito descontente.;0
Eu poderia ter tido um defeito, mas não correria o risco de comprá-lo novamente por causa da qualidade construída.;0
Eles fizeram esse gabinete muito pequeno e é muito difícil de instalar.;0
Restaurou meu telefone para gostar de um novo desempenho.;1
Eu recomendaria comprar o Jabra JX-10 series 2, que funciona perfeitamente com o meu Moto Q, vai entender.;1
Pesquisei na Internet e achei esse o melhor valor.;1
Não serve.;0
Muito feliz com este produto.;1
O tamanho da tela é grande, o teclado está iluminado o suficiente e a qualidade da câmera é excelente para um telefone com câmera.;1
Não há realmente nada de ruim que eu possa dizer sobre esse fone de ouvido.;0
Estou feliz por encontrar este produto na Amazon, é difícil de encontrar, não era caro.;1
Portátil e funciona.;1
Agora, meu colega e eu recebemos uma ótima recepção. Um pouco caro, mas o desempenho é ótimo.;1
Até carreguei completamente antes de ir para a cama, desliguei o dente azul e o wi-fi e notei que restavam apenas 20% pela manhã.;0
Também tive problemas com o telefone ao ler o cartão de memória no qual sempre o ligo e depois desligo.;0
Não é bom quando vestindo um chapéu ou óculos de sol.;0
Envio atempado e produto de qualidade.;1
Bom teclado sólido.;1
Muito bem feito e se encaixa perfeitamente no meu Surefire GX2.;1
Telefone horrível.;0
BT50 lixo da bateria !.;0
Nós os recomendamos a outros.;1
Não é possível fazer o software funcionar com o meu computador.;0
Decepcionado!;0
falta de clareza de voz.;0
A bateria funciona muito bem!;1
Nenhum comprador se arrepende deste!;0
Muito decepcionado com o AccessoryOne.;0
Acho isso imperdoável e provavelmente retornará este telefone e talvez mudando de operadora.;0
"Parece ótimo e é forte. """;1
Eu tenho o serviço TMobile há 2 ou 3 anos e estou muito feliz com isso.;1
O procedimento de atualização é difícil e complicado.;0
Desapontamento .. Eu odeio tudo o que entra no meu ouvido.;0
Ótimo software para Motorolas.;1
A entrega foi pontual.;1
Muito fácil de usar.;1
Desconfortável no ouvido, não use com LG VX9900 (EnV).;0
A chave de volume disparou da unidade para um destino desconhecido.;0
Mantém uma carga por um longo tempo, é razoavelmente confortável em condições de uso prolongado e a qualidade do som é tremenda.;1
Eu gostaria de devolvê-lo.;0
O teclado é realmente útil em termos de utilidade e é resistente o suficiente, não espero problemas.;1
As contas da Verizon, no entanto, são difíceis de entender, embora seus planos de preços sejam simples.;0
Após o carregamento durante a noite, essas baterias funcionam muito bem.;1
Você não vai se arrepender!;1
Eu amo esse telefone!;1
Um desapontamento.;0
Não é fácil de usar.;0
Infelizmente, a capacidade de realmente saber que você está recebendo uma ligação é um recurso bastante importante e esse telefone é lamentável a esse respeito.;0
Depois troquei pelo mesmo telefone, mesmo que tivesse o mesmo problema.;0
Isso faz com que o telefone fique preso no volume máximo ou mudo.;0
Este PDA é ótimo.;1
É super carregado para uso como um pequeno palmtop / câmera / celular híbrido e é excelente nessas funções.;1
Eu recomendaria definitivamente o Jabra BT250v para quem procura conforto, clareza e um ótimo preço!;1
Eu tinha Verizon há 2 anos e realmente gostei do seu serviço.;1
Um belo pedaço de lixo.;0
O plugue estava do tamanho errado.;0
Funciona como descrito.;1
Economize seu dinheiro .... Eu tenho esse item há 11 meses.;0
Compra ruim.;0
BEM IM SATISFEITO.;1
O cancelamento de ruído da bose é incrível, o que é muito importante para um viajante de Nova York.;1
Esta bateria é uma excelente pechincha!;1
Porcaria com defeito.;0
Eu não teria dado nenhuma estrela se fosse capaz.;0
Eu uso óculos e se encaixa bem com eles.;1
A qualidade do som do dispositivo é inaceitável. A menos que você esteja em uma área muito tranquila, quase não ouvirá nada.;0
Eu não recomendaria este item a ninguém.;0
O coldre que chegou não corresponde à foto no anúncio.;0
ótimo ... sem problemas !.;1
Como observou uma revisão anterior, conecte este carregador e nada acontece.;0
Este charme de telefone sapo é adorável e muito atraente.;1
Você nunca sabe se pressionou o suficiente ou o número certo de vezes para a função que deseja ou não.;0
O som é nítido e as pessoas com quem falo também ficam impressionadas com a qualidade.;1
Comprei o estojo de alumínio para o meu novo Palm VX e funcionou muito bem - ele protegeu meu computador de mão perfeitamente até agora.;1
produto muito bom, bem feito.;1
Ferramentas de telefone móvel são um must have.;1
Estou muito impressionado com o trabalho que a Motorola fez com a robustez deste telefone.;1
Recebi meus pedidos dentro do prazo de entrega, tudo estava em boas condições de funcionamento e, no geral, estou muito animado por ter essa fonte.;1
O telefone é resistente e impermeável.;1
Não estou impressionado com isso e eu não recomendaria este item a ninguém.;0
Minha única reclamação é que o volume padrão do som é um pouco baixo, mesmo quando aumentado para 5 (de 5);0
Mais uma vez obrigado à Amazon por ter as coisas de que preciso por um bom preço!;1
Acabei deslizando-o na borda da minha calça ou bolso traseiro.;1
Eu tive que ir a uma loja e comprei um novo telefone NOKIA que está funcionando muito bem.;1
Funciona bem!.;1
REALMENTE FEIO.;0
horrível, tive que mudar 3 vezes.;0
A proteção contra ruídos é incrementável.;1
Nenhuma melhoria real.;0
Bateria Razr - Boa compra.;1
Mantenha o bom trabalho Amazon !!;1
Eles se recusam a reembolsar ou substituir.;0
Infelizmente, é fácil ativá-los acidentalmente com os botões de toque suave se você tocar acidentalmente o telefone no rosto enquanto ouve.;0
Então, basicamente joguei meu dinheiro pela janela por nada.;0
Ótimo caso e preço!;1
Tudo o que precisou foi uma gota de cerca de 15 cm acima do balcão da cozinha e estava rachada. Não estou impressionada e não estou rindo.;0
O alcance do Bluetooth é bom - há alguns dias deixei meu telefone no porta-malas, recebi uma ligação e continuei a conversa sem problemas.;1
Configuração pequena, elegante e impressionante, prática, com amplo armazenamento no local.;1
Os eargels canalizam o som diretamente no ouvido e parecem aumentar o volume e a clareza do som.;1
nenhum dos novos funcionou corretamente.;0
Estou feliz por ter comprado.;1
Perdi várias chamadas por esse motivo.;0
Talvez meu telefone esteja com defeito, mas as pessoas não podem me ouvir quando eu o uso.;0
Não compre este produto.;0
sugado, a maioria das coisas não funciona com o meu telefone.;0
Sem mudança, sem borbulhar, sem descascar, nem mesmo um arranhão, NADA! Eu não poderia estar mais feliz com o meu novo para o Droid.;1
O pior software já usado ... Se eu pudesse dar zero estrelas, eu daria.;0
Tentar ligar para eles é um exercício de frustração.;0
A caixa é uma peça de plástico frágil e não possui proteção frontal ou lateral.;0
Eu possuo um Jabra Earset e fiquei muito feliz com ele, mas a qualidade do som, especialmente de saída, é melhor.;1
Eu amo a câmera, é realmente muito boa qualidade.;1
Obrigado por esse ótimo serviço.;1
É um pacote total.;1
O vendedor é muito compreensivo e paciente, eu definitivamente compraria deles novamente.;1
"Dou 1 estrela a Wirefly. Entrarei em contato com a Cingular / AT & T; e informá-los dessa prática.";0
É AGRAVANTE!;0
Bom produto para o preço!.;1
Comprei-os para a família e os amigos e todos desfrutam de clareza e facilidade de uso;1
Virgin Wireless arrasa e o mesmo acontece com este pequeno telefone barato!;1
Nada disso funciona, apenas não compre.;0
Som enlameado e de baixa qualidade, e o invólucro ao redor da pastilha do fio estava super colado e escorregou.;0
Por favor, não desperdice seu dinheiro.;0
Em suma, estou bastante satisfeito com esta compra.;1
Se você estiver procurando por um headset de boa qualidade da Motorola, não é isso.;0
No entanto, a Plantronincs continua usando o mesmo design defeituoso do carregador.;0
Resultados decepcionantes.;0
Projeto pesado.;0
Ótimo foi novo empacotado nice funciona bem, sem problemas e veio em menos tempo, então eu esperava !!!!;1
Ótimo produto.;1
É uma peça de sucata!;0
Minha experiência foi terrível ..... Este foi o meu quarto fone de ouvido bluetooth e, embora fosse muito mais confortável do que meu último Jabra (que eu odiava !!!;0
Isso corrige todos os problemas.;1
Pior de sempre.;0
estou muito feliz;1
Não tive problemas para acessar a Internet, baixar toques ou executar qualquer uma das funções.;1
"Eu mal posso ouvi-lo e estou constantemente dizendo ""o quê?""";0
A vida da bateria é altamente inaceitável.;0
Essa empresa é uma piada.;0
Faz tudo o que a descrição disse que faria.;1
Devido a isso em todas as chamadas, fui forçado a parar de usar este fone de ouvido.;0
Funciona muito bem com um carregador de carro, especialmente se você não pode conectar dois adaptadores ao mesmo tempo.;1
O suporte técnico da Verizon orientou-me em alguns procedimentos, nenhum dos quais funcionou e eu acabei tendo que fazer uma redefinição difícil, apagando todos os meus dados.;0
Qualidade de voz, intensidade do sinal, chamadas interrompidas.;0
"Toca mais alto do que qualquer outro alto-falante desse tamanho; o preço é tão baixo que a maioria pensaria que a qualidade está faltando, no entanto, não está.";1
Melhor que o esperado.;1
Parece mal construído, os menus são difíceis de navegar e os botões são tão embutidos que é difícil pressioná-los.;0
A bateria está aguentando bem.;1
Também é difícil de colocar. Recomendo evitar este produto.;0
Eu usei apenas dois dias, e nem sempre foi fácil ouvir isso.;0
Peguei o carregador do carro e nem depois de uma semana o carregador estava quebrado ... Fui ligá-lo e ele começou a fumar.;0
Sprint - terrível serviço ao cliente.;0
Vinculado ao meu telefone sem esforço.;1
Eles são tão legais!;1
Fácil de usar.;1
Melhor do que novo.;1
O que me possuiu para pegar esse lixo, não faço ideia ...;0
Pedaço de lixo.;0
Um produto muito bom.;1
Este é um ótimo celular!;1
Pelo preço na Amazon, é um excelente produto, que eu recomendo.;1
A divisão de Pesquisa e Desenvolvimento obviamente sabe o que está fazendo.;1
O verdadeiro assassino é o volume e, é claro, está quebrando.;0
Esses telefones estão funcionando muito bem agora.;1
Estou mais do que feliz com este produto.;1
Má construção.;0
Isso é irritante.;0
No geral, eu recomendaria este telefone pelo novo Walkman.;1
A Sprint cobra por este serviço.;0
É barato, e parece e parece tão barato.;0
Cabe bem no meu ouvido e é confortável.;1
Não funciona na Europa ou na Ásia.;0
prender isso no seu cinto fará com que você se sinta como o futuro de 50 centavos.;1
Eu gosto do design e da aparência da Jabra usando os fones de ouvido e o 5020 é bastante confortável de usar 24 horas por dia sem dor no ouvido.;1
Fiquei espantado com a rápida chegada das duas baterias originais de celular LG e com uma fração do preço.;1
o pior celular da samsung ... porcaria ..... esse porcaria Samsung E715 .. é o pior que eu já vi.;0
o carregador funcionou por cerca de uma semana e parou completamente de carregar meu telefone.;0
Mau produto.;0
No entanto, eu precisava de algumas instruções melhores.;0
Você precisa de duas mãos para operar a tela. Essa interface de software tem uma década e não pode competir com novos designs de software.;0
Funcionou muito bem emparelhado com um Treo 700w e como fone de ouvido do Skype no meu PC (usando um transceptor USB Bluetooth).;1
Evite este produto e use as canetas de substituição originais da Palm, que vêm em um pacote de três.;0
NÃO COMPRAR NÃO COMPRAR SUGA;0
Este é um ótimo produto ... com certeza é melhor do que usar os dedos !.;1
Além disso, eu realmente não acredito que valha a pena seu preço íngreme.;0
Todos os outros casos que tentei normalmente desmoronam depois de alguns meses, mas este parece durar muito tempo.;1
Desempenho muito decepcionante.;0
Não cometa o mesmo erro que eu cometi e, por favor, não compre este telefone.;0
Este telefone pode muito bem ser o pior que já tive em qualquer marca.;0
Case foi mais ou menos um extra que eu coloquei originalmente, mas depois descartei porque arranhou minha orelha.;0
Eu recomendo o iGo para qualquer pessoa com diferentes celulares / mp3 players da família.;1
Não se preocupe - vá à loja.;0
Postei comentários mais detalhados sob o telefone cinza ou preto, mas tenho o Fire Red e é uma ótima cor!;1
Não tive nenhum problema com este item e o pediria novamente, se necessário.;1
Você recebe o que você paga, eu acho.;0
O software não apenas fez um ótimo trabalho nisso, como também criei meus próprios toques para formar meus CDs existentes sem conexão à Internet.;1
Estou surpreso que este é um carregador de carro de boa qualidade e não há muitas críticas sobre ele.;1
Estes são fabulosos!;1
No entanto, atualmente, os fones de ouvido BT não são bons para jogos em tempo real, como jogos de tiro em primeira pessoa, pois o atraso no áudio me atrapalha.;0
Usei o bitpim (um programa gratuito que você pode encontrar na internet) para transferir dados para o telefone. O preço do cabo era excelente.;1
Acessório decepcionante de um bom fabricante.;0
Realizou um som estúpido e abafado, horrível, e eco grave para os que estavam do outro lado da chamada.;0
Muito resistente ao vento.;1
Obviamente, eles têm um péssimo atendimento ao cliente, então você obtém o que paga.;0
Eles não duram para sempre, mas não são muito caros para substituir. Fácil de operar e o som é muito melhor do que outros que tentei.;1
Entrei em contato com a empresa e eles me disseram que, embora a unidade ainda estivesse na garantia, se eu não pudesse produzir meu recibo, estava sem sorte.;0
A Linksys deve ter uma maneira de trocar um telefone ruim por uma unidade de recondicionamento ou algo assim!;0
O telefone é resistente como todos os telefones nokia bar.;1
Ótimo telefone.;1
Quando coloquei meu treo no estojo, ele não apenas não estava confortável, mas havia muito espaço extra nas laterais.;0
Estou satisfeito.;1
A bateria está péssima.;0
Eu achei o produto fácil de configurar e usar.;1
O fone de ouvido é muito grande ou muito pesado ... continua caindo do meu ouvido.;0
Uma porcaria total. A qualidade do som é TERRÍVEL.;0
O carregador chegou dentro do prazo prometido, mas não funcionou.;0
Não é necessário um laço para a orelha, é minúsculo e o som é ótimo.;1
Finalmente, depois de três ou quatro vezes a mola da trava quebrou e eu não consegui mais usá-la na viseira.;0
A parte do viva-voz funciona bem, mas o carro tenta fazer o download do catálogo de endereços e o Treo é reiniciado. No geral, eu ainda avalio esse dispositivo alto.;1
Fale sobre o atendimento ao cliente USELESS.;0
"Parecia muito leve e ""minúsculo"".";0
Isso não se encaixa no Palm Tungsten E2 e quebrou na primeira vez que tentei conectá-lo.;0
Estou feliz com esta compra - de boa qualidade e preço baixo.;1
Adoro a aparência dos flipphones Samsung.;1
É bem desenhado e muito nítido - o azul é uma cor muito agradável.;1
Faz tudo o que deveria e muito mais.;1
Eu não poderia recomendar mais isso.;0
Som agradável.;1
Parece bom na foto, mas este caso foi uma grande decepção !!;0
Muito menos do que o osso da mandíbula que eu iria substituí-lo.;1
A instalação correu muito bem.;1
é extremamente lento e leva uma eternidade para fazer qualquer coisa com ele.;0
"Um estudo obrigatório para qualquer pessoa interessada nos ""piores pecados"" do design industrial.";0
A primeira coisa que aconteceu foi que o rastreamento estava desligado.;0
É bem feito, fácil de acessar o telefone e possui um prendedor de cinto destacável e prático.;1
Então tive que continuar emparelhando-o periodicamente, pois de alguma forma continuava caindo.;0
Não é possível fazer upload de toques de terceiros.;0
O Bluetooth não funciona, o telefone trava, as telas piscam e agora ele faz chamadas aleatoriamente enquanto meu bolso está bloqueado.;0
Verdadeiramente horrível.;0
Funciona bem no meu celular Motorola 325 e muito melhor do que a bateria gasta.;1
O volume da campainha é REALMENTE bom (você tem opções de quão alto).;1
E nenhum dos tons é aceitável.;0
o equilíbrio de cores da câmera é INCRÍVEL.;0
"Claramente, este produto não está pronto para o horário nobre; não me importo com o quão legal é, se você não pode dizer que uma ligação está chegando, é inútil.";0
Eu amo os toques porque eles são muito animados!;1
Falsificações chinesas abundam !.;0
Fácil de emparelhar com o meu Samsung Cell.;1
As instruções não explicaram que uma tomada de microfone poderia ser usada.;0
Eu aconselho a não comprar este item que nunca funcionou muito bem.;0
Pena que você tem que pagar até $$$ por mês pelo serviço!;0
Funciona bem.;1
O cabo USB do nokia CA-42 não funcionou com o meu telefone.;0
Som nítido e claro.;1
Eu tenho que usar os menores fones de ouvido fornecidos, mas ele permanece bem.;1
A maior reclamação que tenho é que a bateria é muito rápida.;0
O design pode ser ergonômico em teoria, mas eu não aguentava tê-los no meu ouvido.;0
NÃO compre se você quiser usar o coldre.;0
O telefone também pode tirar ótimas fotos e até videoclipes.;1
Não faz você parecer legal.;0
Como os dois ouvidos estão ocupados, o fundo não é perturbador.;1
Ajuste confortável - você precisa que o fone de ouvido fique confortável por pelo menos uma hora por vez, se não durante um dia inteiro.;1
Além disso, o telefone parece não aceitar nada, exceto mp3 CBR, de preferência copiado pelo Windows Media Player.;0
Você não pode bater o preço com estes.;1
* Vem com uma luz forte que você pode usar para iluminar as fotos da câmera e até piscar sinais SOS (sério!;1
leve e funciona bem.;1
Então, tenha cuidado.;0
Adoro este cabo - ele permite conectar qualquer dispositivo mini-USB ao meu PC.;1
Portanto, qualquer pessoa próxima a você ouvirá parte de sua conversa.;0
Isso é legal porque a maioria dos casos é aberta apenas para permitir que a tela fique toda arranhada.;1
Comprei este telefone como substituto do meu StarTac e lamento desde então.;0
Parece realmente superar a bateria original da China que acompanha o meu V325i.;1
Não é possível armazenar nada além de números de telefone no SIM.;0
Dura menos de 3o minutos, se eu realmente tentar usar o telefone. Minha esposa tem o mesmo telefone com o mesmo problema.;0
Má qualidade.;0
"gel de ouvido jabra ""R"" o melhor !.";1
Não vale a pena.;0
O telefone travou completamente e agora tenho que substituí-lo.;0
Parou de funcionar depois de usá-lo por cerca de 18 meses, então acabei de comprar outro, porque este é o melhor fone de ouvido que já tive.;1
Infelizmente, ele não recarrega meu iPhone 4s, apesar de conectá-lo a partir de várias fontes de energia (iMac, bateria externa, tomada de parede, etc.).;0
Foi um ótimo celular.;1
se você simplesmente quer um telefone flip pequeno - procure outro lugar, pois os sinos e assobios extras são medíocres.;0
Bom valor, funciona bem - alimentação via USB, carro ou tomada.;1
Meu telefone não desliza ao redor do meu carro agora e a aderência impede que meu telefone escorregue da minha mão.;1
Este é simplesmente o MELHOR fone de ouvido bluetooth para qualidade de som!;1
Pense nisso quando você planeja possuir este! Este é certamente o último telefone MOTO para mim!;0
"No espaço de uma hora, duas pessoas exclamaram ""Whoa - esse é o novo telefone na TV?!?";1
Eu sempre usei fones de ouvido com fio e a liberdade da conexão sem fio é muito útil.;1
Este gabinete ultrapassou a marca de um ano e, embora mostre sinais de desgaste, é 100% funcional.;1
"Fora isso, o couro é bonito e macio; o ajuste é muito apertado; o corte para o rosto é uma boa forma.";1
Tem tudo o que preciso e não poderia pedir mais.;1
Depois de receber e usar o produto por apenas 2 dias, ele quebrou.;0
Este produto é ótimo ... torna o trabalho muito mais fácil. Posso ir à copiadora enquanto aguardo algo em espera.;1
Nenhum dos três tamanhos que eles enviaram com o fone de ouvido ficava nos meus ouvidos.;0
A T-Mobile tem o melhor atendimento ao cliente em qualquer lugar.;1
Chegou rapidamente e muito mais barato do que outros vendidos.;1
Tentamos 2 unidades e ambas falharam em 2 meses. Prós;0
Fornece boa proteção e parece elegante também.;1
Krussel Sempre bom.;1
O site do tracfonew é amigável e facilita a ativação, etc.;1
O design é muito bom.;1
Eu ótima recepção o tempo todo.;1
Eu recomendo este produto.;1
Não foi possível usar a unidade com óculos de sol, não é bom no Texas!;0
Não funciona na maioria das vezes com o meu Nokia 5320.;0
Comprou principalmente pelo carregador, que quebrou logo após a compra.;0
Se você gosta de um zumbido alto para substituir todas as suas conversas, este telefone é para você!;0
Compra fantástica e receberei novamente por qualquer que seja o meu próximo telefone;1
fique longe desta loja, tenha cuidado.;0
Este alto-falante do telefone mãos-livres BlueAnt Supertooth é INCRÍVEL.;1
Não serve.;0
.... O item chegou rapidamente e funciona muito bem com o meu telefone deslizante Metro PCS Samsung SCH-r450 e o Sony Premium Sound em tampões para os ouvidos.;1
É leve, possui muita capacidade da bateria e é muito confortável de usar por períodos prolongados.;1
decepcionante.;0
Blue Ant é fácil de usar.;1
Barato, mas olha que funciona .. Fiquei agradavelmente surpreso, dado o baixo custo deste item.;1
A câmera do telefone pode ser usada como uma pá de lixo em ambientes fechados ... Prefiro usar um descartável do que isso.;0
Alguns dias depois, uma nuvem de fumaça saiu do telefone enquanto estava em uso.;0
É muito conveniente e simples de usar - faz o trabalho e torna o carro muito mais suave.;1
O nano afirmou que. Meu filho estava desapontado.;0
A qualidade do som também é excelente.;1
É o melhor fone de ouvido que já usei.;1
Não recomendo.;0
Eles existem há anos e carregam a mais alta qualidade de protetor de tela anti-reflexo que eu encontrei até o momento.;1
Apenas o que eu queria.;1
Este modelo em particular não funcionaria com o meu smartphone Motorola Q.;0
não funcionará direito ou pelo menos para mim.;0
"além disso, parece & amp; parece que o telefone é todo de plástico leve e barato.";0
"Mas agora que está ""fora da garantia"", os mesmos problemas voltam a aparecer. Linha inferior ... coloque seu dinheiro em outro lugar ... A Cingular não suportará.";0
Eu realmente queria que o Plantronics 510 fosse o caminho certo, mas ele tem muitos problemas para mim.;0
Ótimo produto.;1
Fresco e nítido.;1
Após a primeira carga, a carga desapareceu após 12 minutos.;0
Um plástico MUITO barato, range como um velho piso de madeira.;0
Recebo uma recepção absolutamente horrível no meu apartamento, onde com outros telefones eu não tive esse problema.;0
A recepção tem sido geralmente boa.;1
Excelente som, duração da bateria e discreto para inicializar !.;1
Ótimo bluetooth !.;1
Eu recomendo este caso.;1
QUE VALE A PENA.;1
Isso é muito.;1
Depois que meu telefone tinha cerca de um ano, ele foi quebrado lentamente, apesar de muito cuidado da minha parte.;0
Lamento ter feito esta compra.;0
Comprei esses itens esperando poder fazer o meu fone de ouvido Bluetooth se encaixar melhor, mas essas coisas impossibilitavam o uso.;0
A Treo e a T-Mobile se recusaram a substituí-lo novamente e me forçaram a comprar outro telefone sem qualquer tipo de desconto na atualização.;0
Foi horrível!.;0
Eu não acho que seria muito seguro em seu cinto.;0
Isso permite a possibilidade de reserva dupla para a mesma data e hora após a primeira.;0
Eles trabalham cerca de 2 semanas e depois quebram.;0
É simples de usar e eu gosto.;1
É uma ótima ferramenta para entretenimento, comunicação e gerenciamento de dados. Use o ActiveSync 4.2 para obter ótimos resultados de sincronização de dados!;1
Não posso usar este caso porque o cheiro é nojento.;0
NÃO O QUE EU QUERIA.;0
